{
  "version": "s1",
  "updated_at": "2026-04-07",
  "templates": {
    "clarify_intro": "To recommend the right earbuds, {questions}",
    "tradeoff_prefix": "There is a tradeoff between price and top-tier sound.",
    "recommend_main": "Based on your needs, I recommend {name} (${price}).",
    "price_alternative": "For a lower-cost alternative, {name} (${price}) gives solid value without overpaying.",
    "price_fallback": "I can suggest a lower-cost alternative that keeps strong value.",
    "cta_soft": "If you want, I can narrow this down to one final pick.",
    "cta_close": "If this sounds right, I can help you finalize one option now."
  },
  "snippets": {
    "trust_authentic": "All products are authentic with {warranty_months}-month warranty.",
    "trust_return": "You also get a {return_policy_days}-day return window."
  },
  "style": {
    "max_words_soft": 85,
    "prefer_short_sentences": true
  }
}